{
  "command_id": "cmd-0002",
  "command_kind": "APPLY_FRAME",
  "encoding": "json",
  "hardware_io_allowed": false,
  "intent_id": "intent-0002",
  "payload": {
    "command": "APPLY_FRAME",
    "electrodes": [
      {
        "channel_id": 128,
        "electrode_id": "E0128",
        "frequency_hz": 1000,
        "state": "ON",
        "voltage_v": 120,
        "x": 15,
        "y": 7
      }
    ],
    "tick": 1
  },
  "raw_line": "{\"command\":\"APPLY_FRAME\",\"electrodes\":[{\"channel_id\":128,\"electrode_id\":\"E0128\",\"frequency_hz\":1000,\"state\":\"ON\",\"voltage_v\":120,\"x\":15,\"y\":7}],\"tick\":1}",
  "serial_command_version": "klein.opendrop_serial_command.v1",
  "tick": 1
}
